{"schema_version":1,"id":"spoken_russian","display_name":"Spoken Russian evidence","status":"PLANNED","evidence_type":"SPOKEN_USAGE","adapter":"evidence_v1","enabled_by_default":false,"network_required":true,"failure_policy":"SKIP","timeout_ms":800,"description":"Evidence from spoken Russian for ellipsis, particles, repetition, discourse structure and word order.","capabilities":["spoken_usage","ellipsis","particles","discourse_structure"],"references":["evidence/README.md"]}
